{
  "$schema": "http://json-schema.org/draft-07/schema#",
  "id": "template-channel",
  "name": "Nome do Perfil ou Canal",
  "slug": "template-channel",
  "archetype": "personal_brand",
  "description": "Perfil pessoal ou canal de conteúdo para distribuição multicanal.",
  "category": "tecnologia",
  "features": {
    "articles": true,
    "carousels": true,
    "social_posts": true,
    "video": false
  },
  "branding": {
    "handle": "@seuperfil",
    "badge_text": "TECH & ARQUITETURA",
    "theme_colors": {
      "primary": "#3B82F6",
      "background": "#0F172A",
      "text": "#FFFFFF",
      "secondary_text": "#E2E8F0"
    },
    "typography": {
      "bold_font": "/usr/share/fonts/truetype/dejavu/DejaVuSans-Bold.ttf",
      "regular_font": "/usr/share/fonts/truetype/dejavu/DejaVuSans.ttf"
    }
  },
  "social": {
    "linkedin": {
      "handle": "seunome",
      "profile_id": "",
      "buffer_channel_id": ""
    },
    "x_twitter": {
      "handle": "seunome",
      "buffer_channel_id": ""
    },
    "instagram": {
      "handle": "seunome",
      "buffer_channel_id": "",
      "default_hashtags": [
        "#tecnologia",
        "#software",
        "#desenvolvimento"
      ]
    },
    "threads": {
      "handle": "seunome",
      "buffer_channel_id": ""
    },
    "youtube": {
      "channel_id": "",
      "buffer_channel_id": "",
      "default_privacy": "public"
    },
    "devto": {
      "username": "seunome",
      "organization": ""
    },
    "ghost_substack": {
      "publication_url": ""
    }
  },
  "video": {
    "enabled": false,
    "channel_name": "NOME DO CANAL",
    "badge_text": "CONTEÚDO OFICIAL // NÍVEL 1",
    "sub_text": "HISTÓRIAS, CURIOSIDADES E INVESTIGAÇÕES",
    "classified_code": "REF // CANAL-OFICIAL",
    "primary_color": "#3B82F6",
    "background_color": "#0A0C10",
    "default_aspect_ratio": "9:16",
    "standard_short_duration_sec": 65.0
  },
  "settings": {
    "auto_sanitize": true,
    "default_aspect_ratio": "4:5"
  }
}
